{
  "fromDate": "2019-03-11",
  "toDate": "2020-04-23",
  "income": {
    "periodAmount": 123.45,
    "premiumsOfLeaseGrant": 2355.45,
    "reversePremiums": 454.56,
    "otherIncome": 567.89,
    "taxDeducted": 234.53,
    "rentARoom": {
      "rentsReceived": 567.56
    }
  },
  "expenses":{
    "premisesRunningCosts": 567.53,
    "repairsAndMaintenance": 324.65,
    "financialCosts": 453.56,
    "professionalFees": 535.78,
    "costOfServices": 678.34,
    "other": 682.34,
    "travelCosts": 645.56,
    "residentialFinancialCostsCarriedForward": 672.34,
    "residentialFinancialCost": 1000.45,
    "rentARoom": {
      "amountClaimed": 545.9
    }
  }
}